{
  "schema_version": "kspacejet.target-envelope/v1",
  "kind": "TargetEnvelope",
  "envelope": {
    "id": "org.example.cartesian-target",
    "revision": "1.0.0"
  },
  "limits": {
    "max_xml_bytes": 65536,
    "max_acquisition_charged_bytes": 1048576,
    "max_frame_charged_bytes": 16777216,
    "max_image_charged_bytes": 16777216,
    "max_decoder_staging_bytes": 4194304,
    "max_samples_per_acquisition": 8192,
    "max_trajectory_dimensions": 3,
    "max_channels_per_acquisition": 64,
    "max_channel_groups": 1,
    "max_active_scans": 1,
    "max_dynamic_keys_per_projection": {
      "encoding": 1,
      "slice": 1,
      "contrast": 1
    },
    "max_calibration_prefix_items_per_key": 0,
    "max_calibration_prefix_charged_bytes_per_key": 0,
    "max_calibration_prefix_items_aggregate": 0,
    "max_calibration_prefix_charged_bytes_aggregate": 0,
    "max_active_calibration_keys": 0,
    "max_external_input_stall_us": 1000000,
    "max_external_output_stall_us": 1000000
  },
  "arrival_envelope": {
    "kind": "token_bucket",
    "max_items_per_second": 1000,
    "max_charged_bytes_per_second": 104857600,
    "max_burst_items": 64,
    "max_burst_charged_bytes": 67108864
  },
  "sink_service_assumption": {
    "minimum_drain_items_per_second": 100,
    "minimum_drain_charged_bytes_per_second": 10485760,
    "maximum_pause_us": 100000,
    "slow_sink_policy": "fail",
    "max_transport_staging_bytes": 16777216,
    "max_spool_charged_bytes": 0
  },
  "metadata": {
    "annotations": {}
  }
}
